Question_ID,Category,Question,Short_Answer,Detailed_Answer,Keywords
74,Funeral Costs,What does cremation cost?,Typically $1000-$7000,"Direct cremation (no service) costs $1,000-$3,000. Cremation with memorial service costs $5,000-$7,000. Costs include cremation fee ($300-$600), container ($50-$500), and urn ($50-$500 for basic).",cremation cost price how much direct cremation
75,Funeral Costs,What does burial cost?,Typically $7000-$12000 plus cemetery,"Traditional burial costs $7,000-$12,000 for funeral home services. Additional cemetery costs include plot ($1,000-$5,000), opening/closing grave ($1,000-$1,500), vault ($700-$7,000), and headstone ($1,000-$5,000). Total: $10,000-$30,000+.",burial cost price how much traditional funeral
76,Funeral Costs,What is most expensive funeral item?,Casket usually most expensive,"The casket is typically the single most expensive item in a funeral, ranging from $800 for basic models to $15,000+ for premium options. The average casket costs $2,000-$4,000.",most expensive funeral item biggest cost casket
77,Funeral Costs,Can I reduce funeral costs?,Yes many ways to save,"Ways to reduce costs: choose direct cremation or burial, skip embalming, have service at church/home, purchase casket from third party, limit viewing hours, choose simple casket, graveside service only, use online obituary, provide your own flowers. Can save $5,000-$10,000.",reduce costs save money lower cheaper affordable funeral
78,Funeral Costs,What is included in basic services fee?,Overhead and administrative costs,"The basic services fee ($2,000-$3,000) is a non-declinable fee that covers funeral home overhead, staff salaries, facilities, administrative costs, obtaining permits, filing death certificate, coordinating arrangements. Required by all funeral homes.",basic services fee overhead funeral home cost non-declinable
79,Funeral Costs,Is embalming required?,Usually not legally required,"Embalming is NOT legally required in most cases. It may be required by funeral homes for public viewing, but is not necessary for direct burial, immediate cremation, or private family viewing. Embalming costs $500-$900. Refrigeration is an alternative.",embalming required necessary mandatory law
80,Funeral Costs,What do cemeteries charge?,Plot opening/closing vault and marker,"Cemetery costs include: burial plot ($500-$20,000 depending on location), grave opening and closing ($1,000-$1,500), grave liner or vault ($700-$7,000), headstone or marker ($500-$20,000), and perpetual care fee ($100-$500). Total: $3,000-$10,000+.",cemetery costs charges burial plot grave expenses
81,Application Process,How long is the application?,Usually 5-15 minutes,"The final expense insurance application typically takes 5-15 minutes to complete. You'll provide basic personal information, answer a few health questions (if simplified issue), choose coverage amount, and name beneficiary. Much shorter than traditional life insurance applications.",application time how long process duration
82,Application Process,Can I apply online?,Yes most companies offer online applications,"Yes, most final expense insurance companies offer online applications with instant quotes and often instant approval. You can also apply by phone with an agent or in person. Online applications are convenient and quick.",apply online application internet digital process
83,Application Process,Can I apply by phone?,Yes phone applications available,"Yes, you can apply for final expense insurance by phone with a licensed agent. The agent will ask health questions, explain policy options, and complete the application for you. This is helpful for seniors less comfortable with technology.",apply by phone telephone call agent process
84,Application Process,What information do I need?,Basic personal and health information,"You'll need: full legal name, date of birth, address, Social Security number, contact information, beneficiary information (name, relationship, contact), coverage amount desired, and answers to health questions (if simplified issue).",application information required needed what to provide documents
85,Application Process,Can I apply without Social Security number?,Usually Social Security number required,"Most final expense insurance companies require a Social Security number for the application and to process the policy. Some may accept an Individual Taxpayer Identification Number (ITIN) for non-citizens, but this varies by company.",Social Security number SSN required needed ITIN
86,Application Process,Do I need a beneficiary to apply?,Yes beneficiary required,"Yes, you must name at least one beneficiary when applying for final expense insurance. You can name a person, multiple people, a trust, or an organization. The beneficiary receives the death benefit when you pass away.",beneficiary required needed must have who gets money
87,Application Process,Can I name a minor as beneficiary?,Yes but consider trust or guardian,"Yes, you can name a minor as beneficiary, but they cannot receive the death benefit directly until age 18-21 (varies by state). Consider setting up a trust or naming a guardian to manage funds until the minor reaches adulthood.",minor child beneficiary under 18 trust guardian
88,Application Process,What if I don't have a beneficiary?,Can name estate or charity,"If you have no family or friends to name, you can name your estate (funds go through probate), a charity, a church, or a funeral home. However, naming your estate may subject funds to creditors and delays.",no beneficiary who to name estate charity options
89,Underwriting,What is underwriting?,Process of evaluating risk,"Underwriting is the process insurance companies use to evaluate your application, assess risk, and determine whether to approve coverage and at what premium. Final expense uses simplified or no underwriting, while traditional life uses full medical underwriting.",underwriting definition what is process evaluation
90,Underwriting,What is simplified issue?,Basic health questions no exam,"Simplified issue underwriting requires answering 3-10 basic health questions but no medical exam, blood tests, or urine tests. Most applicants are approved quickly (24-48 hours) and coverage often starts immediately. Healthier applicants get better rates than guaranteed issue.",simplified issue underwriting definition no exam questions
91,Underwriting,What is guaranteed issue?,No health questions automatic approval,"Guaranteed issue underwriting requires NO health questions at all. Everyone is automatically accepted regardless of health condition and cannot be denied. Usually has a 2-3 year graded waiting period and higher premiums than simplified issue. Ideal for those with serious health problems.",guaranteed issue underwriting definition acceptance no questions
92,Underwriting,What is full underwriting?,Comprehensive medical evaluation,"Full underwriting (used by traditional life insurance) involves extensive health questionnaires, medical exam with blood and urine tests, review of medical records, prescription drug history, motor vehicle records, and sometimes financial information. Takes 4-8 weeks and many applicants are declined or rated.",full underwriting medical exam traditional comprehensive detailed
93,Health Conditions,Can I get coverage with diabetes?,Yes usually accepted,"Yes, people with diabetes can typically get final expense insurance. Type 2 diabetes that is well-managed is usually accepted by simplified issue policies. Even poorly controlled diabetes may be accepted by guaranteed issue policies (no health questions).",diabetes diabetic blood sugar accepted approved coverage
94,Health Conditions,Can I get coverage with cancer?,Depends on status and timeline,"It depends. Cancer in remission for 2+ years is usually accepted by simplified issue policies. Recent cancer diagnosis or active cancer may be declined by simplified issue but accepted by guaranteed issue (with graded benefit waiting period).",cancer diagnosis remission treatment health condition
95,Health Conditions,Can I get coverage with heart disease?,Depends on severity and recency,"Heart disease history may be accepted depending on severity. Past heart attack or stroke 2+ years ago may be accepted by simplified issue. Recent heart attack/stroke or severe congestive heart failure may be declined by simplified issue but accepted by guaranteed issue.",heart disease heart attack stroke cardiac condition
96,Health Conditions,Can I get coverage with COPD?,Yes usually accepted,"Yes, people with COPD (chronic obstructive pulmonary disease) can usually get final expense insurance. COPD, even if requiring medications or inhalers, is typically accepted by simplified issue policies. Severe COPD requiring oxygen may need guaranteed issue.",COPD lung disease emphysema chronic bronchitis breathing
97,Health Conditions,Can I get coverage with high blood pressure?,Yes easily accepted,"Yes, high blood pressure (hypertension) is easily accepted by final expense insurance, whether controlled by medication or not. High blood pressure is very common among seniors and does not typically affect approval or pricing significantly.",high blood pressure hypertension accepted approved coverage
98,Health Conditions,What conditions prevent approval?,Very few with guaranteed issue,"With guaranteed issue, NO health conditions prevent approval. With simplified issue, conditions that may prevent approval include: currently receiving hospice care, terminal cancer with short prognosis, recent major heart attack/stroke, severe organ failure. Most other conditions are accepted.",denied declined conditions health problems rejected disqualified
99,Benefits,What are policy riders?,Optional add-ons to policy,"Policy riders are optional add-ons that provide additional benefits for extra cost. Common final expense riders include: accelerated death benefit (access funds if terminally ill), accidental death benefit (double payout for accidental death), waiver of premium (waives premiums if disabled).",riders add-ons options benefits extras features
100,Benefits,What is accelerated death benefit?,Access funds if terminally ill,"Accelerated death benefit (also called living benefit) allows you to access a portion of your death benefit (typically 25-90%) if diagnosed with a terminal illness with life expectancy of 12-24 months or less. This helps pay medical bills and final expenses while alive.",accelerated death benefit living benefit terminal illness early access
101,Benefits,What is accidental death benefit?,Double payout for accidents,"Accidental death benefit rider pays an additional death benefit (typically double the face amount) if death is caused by an accident rather than natural causes or illness. For example, $10,000 policy would pay $20,000 for accidental death.",accidental death benefit double indemnity AD&B accident rider
102,Benefits,What is waiver of premium?,Waives premiums if disabled,"Waiver of premium rider waives (forgives) your premium payments if you become totally disabled and cannot work. Your coverage continues without you paying premiums. Usually requires disability lasting 6+ months. May be included or available as add-on.",waiver of premium disability disabled cannot pay rider
