Question_ID,Category,Question,Short_Answer,Detailed_Answer,Keywords
1,General,What is final expense insurance?,Small whole life policy for funeral costs,"Final expense insurance is a type of whole life insurance designed to cover end-of-life costs such as funeral expenses, burial or cremation, medical bills, and other final debts. It typically provides coverage between $5,000 and $25,000 and is specifically marketed to seniors ages 50-85.",final expense definition burial insurance funeral insurance
2,General,How much does final expense insurance cost?,Typically $30-$150 per month,"The cost varies based on age, gender, health status, tobacco use, and coverage amount. On average, premiums range from $30 to $150 per month. For example, a 65-year-old might pay $65-$85 monthly for $10,000 coverage.",cost premiums price monthly payment
3,General,Who needs final expense insurance?,Seniors 50-85 wanting to cover funeral costs,"Final expense insurance is ideal for seniors ages 50-85 who want to protect their families from funeral costs, people with health issues who cannot qualify for traditional life insurance, individuals on fixed incomes, and those without sufficient funeral savings.",who needs eligibility ideal candidate target audience
4,General,Is final expense the same as life insurance?,It's a type of life insurance with smaller amounts,"Final expense insurance IS a type of life insurance, but it offers smaller coverage amounts ($5,000-$25,000 vs $100,000+), requires no medical exam, has simplified underwriting, and focuses on funeral costs rather than income replacement.",difference comparison life insurance types
5,General,How much coverage do I need?,Typically $10000-$15000,"Most experts recommend $10,000-$15,000 in coverage since the average funeral costs $7,000-$12,000. This covers funeral expenses plus additional costs like medical bills or small debts.",coverage amount how much recommendation
6,Eligibility,What is the age limit?,Usually 50-85 years old,"Most final expense policies are available for people between ages 50-85, though some companies offer coverage starting at age 45 and extending to age 89. The specific age range varies by insurance carrier.",age limit minimum maximum range requirements
7,Eligibility,Can I get coverage with health problems?,Yes with simplified or guaranteed issue,"Yes! Final expense insurance is designed for people with health conditions. Simplified issue asks few health questions, and guaranteed issue accepts everyone with no health questions. Common accepted conditions include diabetes, high blood pressure, COPD, and past cancer.",health problems pre-existing conditions acceptance approval
8,Eligibility,Will I need a medical exam?,No medical exam required,"No. Final expense insurance does not require a medical exam. There are no blood tests, urine tests, or physical examinations. Most policies only require a few simple health questions.",medical exam blood test physical examination requirements
9,Eligibility,Can I be denied coverage?,Not with guaranteed issue,"With guaranteed issue final expense insurance, you cannot be denied coverage. With simplified issue policies, you can only be denied for certain serious conditions like currently receiving hospice care or recent serious health events. Approval rates exceed 90%.",denied declined rejection approval guaranteed acceptance
10,Eligibility,How long to get approved?,Usually 24-48 hours,"Most final expense insurance applications are approved within 24-48 hours. Some guaranteed issue policies provide instant approval. This is much faster than traditional life insurance which takes 4-8 weeks.",approval time processing how long application speed
11,Eligibility,What health questions are asked?,3-10 basic questions about serious conditions,"Simplified issue policies ask 3-10 questions about serious conditions: cancer in past 2 years, congestive heart failure, recent heart attack/stroke, oxygen therapy use, hospice care. Guaranteed issue asks no health questions.",health questions application questionnaire underwriting
12,Eligibility,Can smokers apply?,Yes but premiums are higher,"Yes, smokers can apply and will be approved, but premiums will be 25-50% higher than non-smokers. Some companies offer better rates for those who quit smoking for 12-24 months.",smokers tobacco cigarettes rates premiums
13,Coverage,When does coverage start?,Depends on policy type,"Level benefit policies provide full coverage from day one. Graded benefit policies have 2-3 year waiting periods for natural death, returning premiums with interest if death occurs during that time. Accidental death is always covered immediately.",coverage start effective date waiting period when begins
14,Coverage,What does it cover?,Funeral costs and any final expenses,"Death benefits can be used for funeral service, burial or cremation, casket or urn, headstone, flowers, outstanding medical bills, credit card debt, personal loans, legal fees, and other end-of-life expenses.",what covered benefits uses purposes expenses
15,Coverage,Is there a waiting period?,Sometimes 2-3 years for natural death,"Immediate coverage (level benefit) policies have no waiting period. Graded benefit policies (common with guaranteed issue) have 2-3 year waiting periods where only premiums plus interest are returned for natural death. Accidental death is covered immediately.",waiting period graded benefit level benefit immediate coverage
16,Coverage,What is NOT covered?,Suicide first 2 years and fraud,"Most policies exclude suicide within the first 2 years, death during commission of a felony, and sometimes death while under the influence. Misrepresentation on the application may result in denial during the 2-year contestability period.",exclusions not covered suicide fraud limitations restrictions
17,Coverage,Can premiums increase?,No they are guaranteed level for life,"No. Final expense insurance premiums are guaranteed to remain level for your entire life. They will never increase due to age, health changes, or any other reason.",premiums increase fixed level locked guaranteed
18,Coverage,Does it build cash value?,Yes but accumulation is small,"Yes, final expense insurance builds cash value over time that you can borrow against or receive if you surrender the policy. However, accumulation is relatively small as the primary purpose is the death benefit.",cash value accumulation savings borrow surrender
19,Coverage,Can I outlive my policy?,No it's lifetime coverage,"You cannot outlive final expense insurance—it's whole life insurance that lasts your entire lifetime as long as you pay premiums. Unlike term life which expires, final expense coverage is permanent.",outlive expire term permanent whole life lifetime
20,Cost,Why is it more expensive per $1000?,Accepts high-risk applicants without exam,"Final expense costs more per $1,000 of coverage because it accepts people with health problems, requires no medical exam, provides permanent lifetime coverage, and insures older populations with higher mortality risk.",expensive cost per thousand rate comparison pricing
21,Cost,Monthly or annual payments?,Flexible payment options available,"Most companies offer monthly, quarterly, semi-annual, or annual payment options. Monthly payments are most common for seniors on fixed incomes.",payment options monthly annual quarterly frequency
22,Cost,What if I miss a payment?,30-day grace period usually,"Policies typically have a 30-31 day grace period. If you pay within this time, coverage continues. If not paid, the policy may lapse and coverage ends. Some policies use cash value to pay missed premiums.",miss payment grace period late lapse reinstatement
23,Cost,Can I cancel and get money back?,Yes if there's cash value,"Yes, you can cancel anytime. If your policy has accumulated cash value, you'll receive the cash surrender value. Early cancellation may result in little or no cash value due to surrender charges.",cancel refund surrender cash value get money back
24,Cost,Are there hidden fees?,No from reputable companies,"Reputable final expense insurance policies have no hidden fees. The quoted premium should be the total amount. Ask about policy fees, whether the quote includes all fees, and surrender charges for early cancellation.",hidden fees costs charges extras policy fees
25,Policy Details,How do I choose a beneficiary?,Name anyone; can change anytime,"You can name anyone—spouse, children, relatives, friends, or charities. You can name multiple beneficiaries with percentages. Some people name the funeral home. You can change beneficiaries anytime unless made irrevocable.",beneficiary designation who can be change update
26,Policy Details,Can I have multiple policies?,Yes from different companies,"Yes, you can purchase multiple policies if you want more coverage. Each application will ask about existing coverage, and companies may limit total amounts based on age and financial situation.",multiple policies more than one several coverage limits
27,Policy Details,Guaranteed issue vs simplified issue?,Guaranteed accepts everyone; simplified asks few questions,"Simplified issue requires answering 3-10 basic health questions but no exam, with most people approved and often immediate coverage. Guaranteed issue requires no health questions, accepts everyone, but usually costs more and has a 2-3 year waiting period.",guaranteed issue simplified issue difference types underwriting
28,Policy Details,Can I increase coverage later?,No; must apply for new policy,"Generally, you cannot increase coverage on an existing policy. To get more coverage, you'd need to apply for a new policy at your current older age with higher premiums. Best to purchase adequate coverage from the start.",increase coverage raise amount more coverage change
29,Policy Details,Is it portable if I move?,Yes fully portable,"Yes, final expense insurance is fully portable. You can move to any state and your coverage continues unchanged. Premiums remain the same and benefits are not affected.",portable move states relocate transfer coverage
30,Claims,How do beneficiaries file a claim?,Contact company with death certificate,"Contact the insurance company to notify of death, obtain certified death certificate, complete claim form, submit form and death certificate, wait 7-14 days for processing.",file claim death benefit process how to claim
31,Claims,How long to receive death benefit?,Typically 7-14 days,"Most final expense claims are paid within 7-14 days after the company receives required documentation. This is faster than traditional life insurance which takes 2-4 weeks.",payout time claim processing how long payment speed
32,Claims,How is death benefit paid?,Check direct deposit or to funeral home,"Death benefits are paid via check to beneficiary, direct deposit to beneficiary's bank account, or direct payment to funeral home if they are named beneficiary or assigned.",payment method check direct deposit how paid
33,Claims,Can funeral home be paid directly?,Yes if named or assigned,"Yes. You can name the funeral home as beneficiary, or the beneficiary can assign the benefit to the funeral home. Many companies will pay funeral homes directly upon request.",funeral home direct payment assign beneficiary
34,Claims,Are death benefits taxable?,No income tax-free,"No. Final expense insurance death benefits are income tax-free to beneficiaries. There is no federal income tax on the death benefit, though large estates may face estate taxes.",taxes taxable income tax estate tax free
35,Claims,What if death during waiting period?,Premiums returned with interest,"If you have a graded benefit policy and die from natural causes during the 2-3 year waiting period, beneficiaries receive all premiums paid plus interest (typically 10%). Accidental death pays full benefit immediately.",waiting period death graded benefit return premiums
36,Comparison,Final expense vs traditional life?,Different purposes and amounts,"Choose final expense if over 50, have health issues, only need funeral coverage, want guaranteed approval. Choose traditional life if under 50, healthy, have dependents, need large coverage for income replacement.",vs traditional life insurance difference comparison which better
37,Comparison,Final expense vs pre-paid funeral?,Insurance more flexible,"Final expense insurance offers portability if you move, flexibility to change funeral homes, beneficiaries can use funds for any purpose, death benefit often higher due to inflation, and you maintain control.",vs pre-paid funeral pre-need insurance comparison
38,Comparison,Cremation or burial coverage?,Personal preference; different costs,"Cremation costs $3,000-$7,000 while burial costs $7,000-$12,000+. Choose coverage based on preference. Cremation may need $7,000-$10,000; burial $10,000-$15,000 to cover all costs.",cremation vs burial coverage how much costs
39,Comparison,Final expense vs savings account?,Insurance provides immediate coverage,"Final expense provides immediate protection—if you die after one premium payment, beneficiaries get full $10,000+. Savings account requires years to accumulate $10,000. However, if you already have $10,000+ saved, you may not need insurance.",vs savings account bank comparison alternative
40,Company Selection,How to choose a company?,Check ratings reviews and service,"Look for A.M. Best rating of A- or higher, good customer reviews, transparent pricing, responsive service, clear policy terms, fast claims payment history, and established company with experience. Get quotes from 3+ companies.",choose company select best ratings reviews
41,Company Selection,What is contestability period?,First 2 years company can investigate,"The contestability period is the first 2 years during which the insurance company can investigate your application for misrepresentation. If they discover fraud and you die during this time, they may deny the claim. After 2 years, policy is incontestable.",contestability period investigation fraud 2 years
42,Company Selection,Can company cancel my policy?,No as long as you pay premiums,"No. As long as you pay premiums on time, the company cannot cancel your policy for any reason including declining health or age. Policy only ends if you stop paying or voluntarily cancel.",cancel policy company cancellation termination guarantee
43,Company Selection,Whole life vs final expense?,Final expense IS whole life,"Final expense insurance IS a type of whole life insurance specifically designed for seniors with smaller amounts ($5,000-$25,000) and simplified underwriting. Traditional whole life offers larger amounts ($100,000+) and requires medical exams.",whole life vs final expense difference types
44,Company Selection,Buy online or through agent?,Both work; agent provides guidance,"Buying online is convenient with instant quotes and sometimes instant approval. Working with an agent provides personalized guidance, helps compare companies, explains terms, and assists with applications. Agents help seniors unfamiliar with technology.",online vs agent buy purchase application process
45,Specific Situations,Can I get insurance for my parents?,Yes with their consent,"Yes, but your parents must consent and cooperate with the application. They must answer health questions and sign the application. You can pay premiums and be beneficiary, but they must be involved.",for parents insure parents buy for someone else
46,Specific Situations,Do I need if I have life insurance?,Depends on your situation,"If you have term life that will expire, final expense provides permanent coverage. If you want to ensure funeral costs don't reduce inheritance, separate final expense earmarks money specifically for burial. Many have both.",already have life insurance need both additional coverage
47,Specific Situations,Can veterans get final expense?,Yes to supplement VA benefits,"Yes, veterans can purchase final expense insurance. While VA provides burial benefits (free burial in national cemeteries, headstones, and $300-$2,000 burial allowances), these don't cover all funeral costs. Final expense supplements VA benefits.",veterans VA benefits military burial national cemetery
48,Specific Situations,What if company goes out of business?,State guaranty associations protect you,"If an insurance company becomes insolvent, state guaranty associations protect policyholders up to $100,000-$300,000 per policy, which more than covers final expense policies of $5,000-$25,000.",company failure bankruptcy protection guaranty association
49,Specific Situations,Can I get on Medicare/Medicaid?,Yes programs don't prevent coverage,"Yes, being on Medicare or Medicaid does not prevent you from purchasing final expense insurance. Many seniors on these programs buy coverage to ensure funeral costs are covered. Medicaid estate recovery typically deducts funeral expenses first.",Medicare Medicaid government programs benefits eligibility
50,Specific Situations,Worth it if no family?,Consider personal dignity and wishes,"Even without family, you may want final expense insurance to ensure dignified funeral, avoid burdening friends or state, specify final wishes, or leave funds to charity. However, if you have sufficient savings and no one to leave money to, may be unnecessary.",no family no beneficiary worth it single alone
51,Policy Management,Can I borrow from my policy?,Yes against cash value,"Yes, once your policy has cash value, you can borrow 80-90% of it. Policy loans charge interest and reduce death benefit if not repaid. However, final expense policies accumulate cash value slowly.",borrow loan cash value policy loan access money
52,Policy Management,How to update beneficiary?,Complete beneficiary change form,"Contact your insurance company and request a beneficiary change form. Complete it with new beneficiary information and return it. The change takes effect when processed. Usually no fee for changes.",update beneficiary change beneficiary modify designation
53,Policy Management,What documents should I keep?,Policy beneficiary forms contact info,"Keep original policy documents, most recent premium receipt, beneficiary designation form, insurance company contact information, and agent contact information in a safe, accessible place. Inform beneficiaries of location.",documents keep policy paperwork records important papers
54,Policy Management,Should I tell my family?,Yes absolutely inform them,"Yes! Absolutely inform family members, especially beneficiaries, that you have coverage. Tell them the company name, policy number, where documents are kept, agent contact information, and coverage amount so they can file claims quickly.",tell family notify inform beneficiaries communication
55,Common Concerns,Is final expense a scam?,No from reputable companies,"No, final expense insurance from reputable, licensed insurance companies is legitimate, not a scam. Be cautious of high-pressure sales, companies with poor ratings, excessive fees, and prices significantly higher than competitors. Always research the company.",scam legitimate fraud real trustworthy reputable
56,Common Concerns,Why so many TV commercials?,Large senior market responsive to advertising,"Final expense is heavily marketed to seniors because there's a large market of seniors with funeral cost concerns, the application process is simple for phone sales, and this demographic is very responsive to direct marketing.",TV commercials advertising marketing ads why so many
57,Common Concerns,Can I get if under 50?,Usually minimum age is 45-50,"Most final expense policies have minimum age 45-50, though some may offer to younger applicants. However, if under 50, traditional term life insurance is usually much better value with more coverage for less money.",under 50 young age too young minimum age
58,Common Concerns,What's the catch with guaranteed issue?,Waiting period and higher cost,"The 'catch' with guaranteed issue is a 2-3 year graded waiting period where only premiums are returned for natural death (accidental death covered immediately), higher premiums than simplified issue, and slightly lower coverage maximums.",catch guaranteed issue downsides cons graded benefit
59,Common Concerns,Will premiums ever go down?,No but they never go up either,"No, final expense premiums are level (fixed) for life, meaning they never go down, but they also never go up. You'll pay the same premium at 75 as at 65, protecting you from increases as funeral costs rise.",premiums go down decrease reduce lower rates
60,Additional,Cremation and burial insurance?,Same thing just marketing terms,"'Cremation insurance' and 'burial insurance' are marketing terms for final expense insurance. The policy doesn't specify which option—it provides a death benefit that can be used for either cremation or burial.",cremation insurance burial insurance same difference
61,Additional,Average funeral cost?,Typically $7000-$12000,"The average funeral costs $7,000-$12,000 depending on location and choices. Full-service burial averages $8,000-$10,000 (not including cemetery costs of $3,000-$5,000). Cremation with service averages $5,000-$7,000. Direct cremation averages $1,000-$3,000.",average funeral cost how much typical price
62,Additional,Funeral vs final expense insurance?,Same thing different names,"'Final expense insurance,' 'funeral insurance,' 'burial insurance,' and 'cremation insurance' are all marketing names for the same type of small whole life insurance policy designed to cover end-of-life costs.",funeral insurance burial insurance names terminology same different
63,Additional,Coverage with terminal illness?,Guaranteed issue may accept,"It depends on illness and prognosis. Guaranteed issue policies will accept you with no health questions but will have waiting period. If currently in hospice care, most policies won't accept. Terminal illness with longer prognosis (1+ years) may qualify for guaranteed issue.",terminal illness hospice dying sick health conditions
64,Additional,What if I stop paying premiums?,Policy lapses after grace period,"If you stop paying, you'll enter a 30-31 day grace period. If you don't pay within this time, your policy lapses and coverage ends. Some policies with cash value may offer automatic premium loans or reduced paid-up insurance.",stop paying premiums lapse grace period non-payment
65,Additional,Do I need if I have savings?,Depends on amount and accessibility,"If you have $10,000-$15,000 in easily accessible savings designated for funeral and you're comfortable with family using those funds, you may not need insurance. However, insurance provides immediate coverage while savings take years to accumulate.",savings account money saved need insurance alternative
66,Additional,Tax deductible premiums?,No but death benefit is tax-free,"No, personal life insurance premiums (including final expense) are not tax-deductible. You pay with after-tax dollars. However, the death benefit beneficiaries receive is income tax-free, which is a significant tax advantage.",tax deductible premiums deduction write off taxes
67,Additional,How to know fair price?,Compare quotes from 3+ companies,"Get quotes from at least 3 companies, compare premiums for same coverage and age, check if you qualify for simplified vs guaranteed issue, verify no excessive fees, use online comparison tools. Expect $30-$150/month for $10,000-$15,000 coverage at age 50-85.",fair price good deal comparison shop quotes
68,Additional,Questions to ask before buying?,Ask about premiums fees waiting periods,"Important questions: exact monthly premium, any additional fees, level or graded benefit policy, waiting period, health disqualifications, company's A.M. Best rating, claims payment time, can see full policy terms, contestability period, cancellation and refund policy.",questions to ask before buying what to ask important
69,Additional,Most important thing to know?,Relieves family of funeral cost burden,"The most important thing is that final expense insurance relieves your family of the financial burden of your funeral and burial costs with no medical exam, guaranteed or simplified approval, affordable premiums, and peace of mind that final expenses are covered.",most important key takeaway main point summary
70,Coverage Details,What is level benefit?,Full coverage from day one,"Level benefit policies provide the full death benefit from day one of the policy, regardless of cause of death. There is no waiting period. This is the most desirable type of final expense coverage.",level benefit immediate coverage full benefit day one
71,Coverage Details,What is graded benefit?,Waiting period for natural death,"Graded benefit policies have a 2-3 year waiting period where only premiums plus interest are returned if death occurs from natural causes. Accidental death is covered immediately at full benefit. After the waiting period, full benefit is paid for all causes.",graded benefit waiting period limited coverage return premiums
72,Coverage Details,What is modified benefit?,Increasing benefit over time,"Modified benefit policies provide partial coverage in early years that increases over time. Typically 25-30% year 1, 50-75% year 2, and 100% year 3+. Accidental death usually pays 100% immediately. Less common than level or graded benefit.",modified benefit increasing limited partial coverage
73,Funeral Costs,What does a casket cost?,Ranges from $800 to $15000+,"Casket costs vary widely: basic cloth-covered wood $800-$1,500, basic steel $1,500-$2,500, mid-range steel $2,500-$4,000, solid wood $3,000-$6,000, and premium bronze/copper $7,000-$15,000+. Cremation containers cost $50-$500.",casket cost price coffin how much
